from_slug,from_location,to_slug,to_location,distance_km,travel_time,route_terrain,suggested_car,waypoints,unique_desc,popular_drop_point,best_time_to_start,destination_about,top_attractions,internal_link_text,internal_link_url,seo_keywords
kochi-airport,Kochi Airport,calicut,Kozhikode (Calicut),160,4.5 Hours,"coastal highway (NH66) moving northwards through bustling towns","Toyota Innova Crysta or Ertiga for a smooth highway journey","Kodungallur, Guruvayur bypass, and Ponnani","Travel north along the Malabar coast with our expert intercity drivers. We ensure a safe, comfortable journey to the culinary capital of Kerala.","Kozhikode City Center, Cyberpark, or Calicut Beach hotels","Early morning to navigate through the busy NH66 intersections smoothly","Kozhikode, historically known as Calicut, is the legendary city where Vasco da Gama first landed in 1498. Today, it is the bustling heart of the Malabar region, famous for its warm hospitality, historic spice trade, and world-class culinary scene.","Food lovers flock here for authentic Malabar Biryani. Key sights include Calicut Beach, Mananchira Square, and the historic SM Street (Mittai Theruvu).","Kochi Airport to Wayanad taxi","/24x7-kochi-airport-taxi-service/kochi-airport-to-wayanad-taxi/","kochi to calicut taxi, kochi airport to kozhikode cab, malabar tour taxi, intercity cab kochi to calicut"
kochi-airport,Kochi Airport,thrissur,Thrissur,50,1.5 Hours,"smooth 4-lane national highway (NH544)","Swift Dzire for a quick and cost-effective intercity transfer","Chalakudy and Kodakara bypass","A fast, highly efficient airport transfer to the cultural capital of Kerala. Smooth highway driving ensures you reach Thrissur in just over an hour.","Thrissur Swaraj Round or major city hotels","Anytime (24x7 service for quick city transfers)","Thrissur is widely known as the Cultural Capital of Kerala, deeply rooted in traditions, arts, and festivals. It is globally famous for hosting the spectacular Thrissur Pooram festival, a grand display of elephants and percussion.","The Vadakkunnathan Temple sits at the center of the city's massive Swaraj Round. Other attractions include the Shakthan Thampuran Palace and the Thrissur Zoo.","Kochi Airport to Guruvayur taxi","/24x7-kochi-airport-taxi-service/kochi-airport-to-guruvayur-taxi/","kochi airport to thrissur taxi, cab to thrissur town, kochi to thrissur drop, cultural capital taxi kerala"
kochi-airport,Kochi Airport,kottayam,Kottayam,80,2.5 Hours,"state highways passing through rubber plantations and towns","Swift Dzire or Ertiga for standard family travel","Muvattupuzha and Ettumanoor","Enjoy a scenic drive through the rubber heartland of Kerala. A highly reliable drop service for both business travelers and families visiting central Kerala.","Kottayam City Center or local rubber estates","Anytime, though daytime offers scenic views of the plantations","Kottayam is a major trading hub for natural rubber and spices, famously known as the 'City of Letters' for its high literacy rate and publishing industry. It is surrounded by lush green landscapes and winding backwaters.","The city is a gateway to Kumarakom. Within the town, the ancient Thirunakkara Mahadeva Temple and the historic St. Mary's Orthodox Syrian Church are major landmarks.","Kochi Airport to Kumarakom taxi","/24x7-kochi-airport-taxi-service/kochi-airport-to-kumarakom-taxi/","kochi to kottayam taxi, kochi airport to kottayam cab, central kerala taxi service, rubber city cab kochi"
kochi-airport,Kochi Airport,kannur,Kannur,250,7.0 Hours,"long stretches of northern coastal highway (NH66)","Toyota Innova Crysta for maximum comfort on a long journey","Calicut bypass, Vadakara, and Thalassery","A premium, long-haul journey to the land of looms and lore. Our spacious vehicles guarantee you will not feel the fatigue of this 7-hour coastal drive.","Kannur City Center, Payyambalam Beach, or Handloom villages","Very early morning to bypass daytime traffic in major Malabar towns","Kannur is a vibrant coastal city in northern Kerala, famous for its ancient ritualistic Theyyam performances, pristine beaches, and its historical significance in the handloom weaving industry.","Must-visit spots include the historic St. Angelo Fort built by the Portuguese, the expansive Payyambalam Beach, and the Muzhappilangad Drive-in Beach.","Kochi Airport to Kozhikode taxi","/24x7-kochi-airport-taxi-service/kochi-airport-to-kozhikode-taxi/","kochi to kannur taxi, kochi airport to kannur cab, long distance taxi to malabar, theyyam tour cab kerala"
kochi-airport,Kochi Airport,palakkad,Palakkad,110,2.5 Hours,"smooth multi-lane national highway (NH544)","Swift Dzire or Ertiga for a fast highway cruise","Thrissur bypass, Kuthiran Tunnel, and Alathur","A rapid, smooth highway transfer to the gateway of Kerala. We utilize the new tunnel routes to drastically cut down travel time and ensure your comfort.","Palakkad Fort, City Center, or nearby Ayurvedic centers","Anytime (24x7 highway service)","Palakkad is known as the 'Gateway of Kerala,' geographically situated at the foot of the Western Ghats. It is famous for its vast, scenic paddy fields, ancient forts, and rich agricultural heritage.","The beautifully preserved Tipu Sultan's Fort (Palakkad Fort) is a major draw, along with the scenic Malampuzha Dam, gardens, and the Silent Valley National Park nearby.","Kochi Airport to Thrissur taxi","/24x7-kochi-airport-taxi-service/kochi-airport-to-thrissur-taxi/","kochi to palakkad taxi, kochi airport to palakkad cab, highway taxi to palakkad, gateway of kerala cab"
kochi-airport,Kochi Airport,bekal,Bekal,330,9.0 Hours,"extremely long coastal highway spanning the entire state","Toyota Innova Crysta is mandatory for this long-haul VIP transfer","Kozhikode, Kannur bypass, and Kasaragod","The ultimate cross-state premium transfer. Travel from central Kerala to the far north in complete air-conditioned luxury with our most experienced highway chauffeurs.","Bekal Fort area or luxury resorts like Taj Bekal","Very early morning to cover maximum distance during non-peak hours","Bekal is a small, incredibly scenic town in the Kasaragod district of northernmost Kerala. It has gained international fame for its massive, beautifully preserved laterite fort and pristine, uncrowded luxury beach resorts.","The iconic, keyhole-shaped Bekal Fort overlooking the Arabian Sea is the star attraction. Visitors also enjoy the tranquil Bekal beach and local backwater cruises.","Kochi Airport to Kannur taxi","/24x7-kochi-airport-taxi-service/kochi-airport-to-kannur-taxi/","kochi to bekal taxi, kochi airport to bekal fort cab, taj bekal taxi service, luxury cab cross state kerala"
kochi-airport,Kochi Airport,poovar,Poovar Island,240,6.0 Hours,"long coastal highway (NH66) passing through Trivandrum","Toyota Innova Crysta for premium long-haul comfort","Kollam, Trivandrum bypass, and Kovalam outskirts","A luxurious, long-distance ride to the southern tip of Kerala. Relax as our drivers take you safely to the boat transfer points for Poovar's island resorts.","Poovar boat jetty for island resort transfers","Very early morning to bypass Trivandrum city traffic","Poovar is an isolated, breathtaking tropical island located at the southern tip of Kerala, where the Neyyar River empties into the Arabian Sea. It is famous for its golden sand beaches and floating cottages.","The main activity is taking a boat cruise through the thick mangrove forests and estuary. It is a highly secluded spot, perfect for romantic honeymoons and wellness retreats.","Kochi Airport to Kovalam taxi","/24x7-kochi-airport-taxi-service/kochi-airport-to-leela-kovalam-taxi/","kochi airport to poovar taxi, poovar island resort cab, trivandrum beach cab, long distance taxi to poovar"
kochi-airport,Kochi Airport,ponmudi,Ponmudi Hills,260,6.5 Hours,"long highway stretch followed by 22 hairpin bends","Toyota Innova Crysta for navigating steep curves safely","Trivandrum bypass and Nedumangad","A thrilling, scenic drive from the airport to the golden peaks of southern Kerala. Trust our verified drivers to safely navigate the famous 22 hairpin bends to the top.","Ponmudi Upper Sanatorium or KTDC Golden Peak Resort","Early morning to reach before the afternoon hill mist sets in","Ponmudi, meaning 'The Golden Peak', is a stunning hill station near Trivandrum. Unlike the tea gardens of Munnar, Ponmudi is characterized by lush green meadows, winding trails, and thick tropical forests.","The drive itself, featuring 22 hairpin bends, is a major attraction. Visitors love the Kallar River, Meenmutty Falls, and the breathtaking views from the Upper Sanatorium.","Kochi Airport to Trivandrum taxi","/24x7-kochi-airport-taxi-service/kochi-airport-to-trivandrum-taxi/","kochi to ponmudi taxi, kochi airport to ponmudi cab, trivandrum hill station taxi, innova to ponmudi hills"
kochi-airport,Kochi Airport,kims-health-trivandrum,KIMS Health Trivandrum,220,5.0 Hours,"long stretch of NH66 with moderate to heavy coastal traffic","Toyota Innova Crysta for patient comfort and legroom on long journeys","Kollam bypass and Attingal town","A stress-free and smooth transfer to one of Kerala's most renowned multi-specialty hospitals. We prioritize careful driving for all medical transfers.","KIMS Health Main Entrance or Emergency Ward","Very early morning or late night to ensure the patient reaches safely without traffic delays","KIMS Health in Trivandrum is a leading healthcare destination in South India, renowned for its advanced medical facilities, highly experienced doctors, and multi-disciplinary treatments. It attracts a large number of medical tourists from across the globe.","While primarily a medical facility, the hospital is well-equipped with patient-friendly amenities. Relatives often visit nearby Trivandrum city attractions like the Napier Museum during extended stays.","Kochi Airport to Aster Medcity taxi","/24x7-kochi-airport-taxi-service/kochi-airport-to-aster-medcity-taxi/","kochi airport to kims trivandrum taxi, kims health cab, medical transfer kochi to trivandrum, patient taxi to kims hospital"
kochi-airport,Kochi Airport,caritas-hospital-kottayam,Caritas Hospital Kottayam,95,2.5 Hours,"smooth national highway followed by state roads","Maruti Ertiga or Innova depending on patient needs","Muvattupuzha and Ettumanoor","Direct and comfortable taxi service from the airport to Caritas Hospital. Our drivers are trained to handle medical passengers with the utmost care.","Caritas Hospital Main Reception block","Anytime (24x7 service for medical emergencies or scheduled appointments)","Caritas Hospital is a premier healthcare institution in central Kerala, located near Kottayam. Known for its compassionate care and advanced oncology, cardiology, and neurology departments, it serves thousands of patients daily.","The hospital provides excellent on-campus facilities for bystanders. It is conveniently located near Kottayam town and the famous Ettumanoor Mahadeva Temple.","Kochi Airport to Amrita Hospital taxi","/24x7-kochi-airport-taxi-service/kochi-airport-to-amrita-hospital-taxi/","kochi airport to caritas hospital taxi, caritas hospital cab, kottayam medical tourism taxi, kochi airport patient transfer"
kochi-airport,Kochi Airport,jubilee-mission-thrissur,Jubilee Mission Hospital Thrissur,55,1.5 Hours,"fast 4-lane national highway (NH544)","Swift Dzire for a quick and smooth intercity medical run","Chalakudy and Thrissur bypass","Fast, safe, and highly reliable airport transfers to Jubilee Mission Hospital. We use the quickest highway routes to ensure timely medical admissions.","Jubilee Mission Main Entrance or Casualty","Anytime (24x7 fast highway medical transfer service)","Jubilee Mission Medical College and Research Institute is a major super-specialty hospital in Thrissur. It is highly regarded for its trauma care, burn unit, and comprehensive medical education programs.","The hospital is situated close to the heart of Thrissur city, allowing bystanders easy access to the Vadakkunnathan Temple and the bustling Swaraj Round for their needs.","Kochi Airport to Rajagiri Hospital taxi","/24x7-kochi-airport-taxi-service/kochi-airport-to-rajagiri-hospital-taxi/","kochi airport to jubilee mission taxi, jubilee hospital thrissur cab, medical taxi kochi to thrissur, fast hospital cab"
kochi-airport,Kochi Airport,believers-church-hospital-thiruvalla,Believers Church Medical College Hospital Thiruvalla,120,3.0 Hours,"state highways passing through multiple central Kerala towns","Toyota Innova Crysta for a smooth ride over suburban roads","Muvattupuzha, Koothattukulam, and Changanassery","A comfortable and direct cab service from the terminal to one of Pathanamthitta district's finest hospitals. Ideal for NRI medical arrivals.","Main Hospital Reception or NRI Patient Lounge","Early morning to avoid the heavy daytime traffic in central Kerala towns","Believers Church Medical College Hospital is a state-of-the-art healthcare facility in Thiruvalla. It offers world-class medical treatments, advanced surgical procedures, and is highly preferred by NRIs returning for healthcare.","Situated in the serene town of Thiruvalla, the hospital campus is massive. Bystanders often visit the nearby Sree Vallabha Temple or the tranquil backwaters of western Thiruvalla.","Kochi Airport to Kottayam taxi","/24x7-kochi-airport-taxi-service/kochi-airport-to-kottayam-taxi/","kochi airport to believers church hospital taxi, thiruvalla hospital cab, medical tourism kerala cab, nri hospital taxi thiruvalla"
kochi-airport,Kochi Airport,kumarakom-lake-resort,Kumarakom Lake Resort,80,2.0 Hours,"highway driving followed by narrow, scenic lakeside village roads","Toyota Innova Crysta for a premium luxury resort transfer","Vembanad Lake viewpoints and bird sanctuary outskirts","Start your luxury backwater vacation the moment you land. Our premium chauffeurs will whisk you away to the world-renowned Kumarakom Lake Resort in absolute comfort.","Kumarakom Lake Resort Main Lobby","Morning or afternoon to enjoy the scenic lakeside drive upon arrival","Kumarakom Lake Resort is a multi-award-winning 5-star luxury heritage property set on the eastern banks of Vembanad Lake. It is celebrated globally, having even hosted international royalty and dignitaries.","Guests enjoy private sunset cruises on the lake, world-class Ayurvedic spa treatments at the Ayurmana, and immediate access to the neighboring Kumarakom Bird Sanctuary.","Kochi Airport to Taj Kumarakom taxi","/24x7-kochi-airport-taxi-service/kochi-airport-to-taj-kumarakom-taxi/","kochi airport to kumarakom lake resort taxi, luxury cab for kumarakom resorts, innova to lake resort, kochi airport resort transfer"
kochi-airport,Kochi Airport,the-raviz-ashtamudi,The Raviz Ashtamudi Kollam,160,4.0 Hours,"long stretches of national highway (NH66) with heavy coastal traffic","Toyota Innova Crysta for maximum comfort on a 4-hour journey","Alappuzha bypass and Kayamkulam","A seamless, luxurious journey down the coast to the majestic Raviz Ashtamudi. Let our professional chauffeurs navigate the highway while you relax.","The Raviz Ashtamudi Main Reception","Very early morning or late night to bypass heavy daytime highway traffic","The Raviz Ashtamudi is a spectacular 5-star luxury resort situated on the banks of the serene Ashtamudi Lake in Kollam. Its architecture elegantly blends traditional Kerala timber work with modern luxury.","The resort offers incredible houseboat dining experiences, a massive infinity pool overlooking the lake, and authentic Ayurvedic wellness therapies at their renowned spa.","Kochi Airport to Leela Kovalam taxi","/24x7-kochi-airport-taxi-service/kochi-airport-to-leela-kovalam-taxi/","kochi airport to raviz ashtamudi taxi, kollam resort cab, luxury transfer to ashtamudi lake, premium taxi for raviz hotel"
kochi-airport,Kochi Airport,spice-village-thekkady,Spice Village Thekkady,150,4.5 Hours,"dense forest roads, elevation changes, and spice plantation routes","Toyota Innova Crysta for spacious legroom on mountain curves","Kuttikkanam misty hills and Pine Forest viewpoints","Embark on a beautiful journey into the heart of Kerala's wildlife sanctuary. Relax in air-conditioned comfort while navigating to this eco-friendly luxury resort.","Spice Village CGH Earth Main Lobby","Early morning to reach before the afternoon wildlife boating sessions","Spice Village, a CGH Earth property, is an eco-friendly tribal-themed luxury resort in Thekkady. It is modeled after the dwellings of the native Manan tribe and is deeply committed to sustainable luxury and organic living.","Guests are perfectly positioned to explore the Periyar National Park, take guided spice plantation tours, and enjoy organic dining sourced directly from the resort's gardens.","Kochi Airport to Munnar hill station taxi","/24x7-kochi-airport-taxi-service/kochi-airport-to-munnar-taxi/","kochi airport to spice village taxi, thekkady resort cab, cgh earth thekkady taxi, innova for spice village, kerala wildlife resort cab"
kochi-airport,Kochi Airport,ambalappuzha-sree-krishna-temple,Ambalappuzha Sree Krishna Temple,105,2.5 Hours,"smooth coastal highways (NH66)","Maruti Ertiga or Swift Dzire for family pilgrimage trips","Alappuzha town bypass and coastal stretches","Experience a punctual and respectful transfer to one of Kerala's most famous Krishna temples. We ensure a comfortable journey for your family's spiritual trip.","Temple Main Entrance (East Nada)","Early morning to attend the morning poojas and taste the famous Palpayasam","The Ambalappuzha Sree Krishna Temple is a highly revered Hindu temple built in the 17th century. It is famous globally for its 'Ambalappuzha Palpayasam', a uniquely delicious sweet milk porridge offered to the deity.","Devotees come primarily for the darshan of Lord Krishna and the sacred Palpayasam. The temple is also renowned for its beautiful traditional Kerala temple architecture and the annual Arattu festival.","Kochi Airport to Guruvayur Temple taxi","/24x7-kochi-airport-taxi-service/kochi-airport-to-guruvayur-taxi/","kochi airport to ambalappuzha taxi, ambalappuzha temple cab, kochi to ambalappuzha drop, kerala temple tour taxi, palpayasam temple cab"
kochi-airport,Kochi Airport,vaikom-mahadeva-temple,Vaikom Mahadeva Temple,55,1.5 Hours,"suburban roads and scenic backwater bridges","Swift Dzire or Ertiga for quick and comfortable travel","Tripunithura and Poothotta backwater stretch","A fast, comfortable ride straight from the airport to the historic Vaikom Mahadeva Temple. Perfect for quick pilgrimage visits in central Kerala.","Temple West or East Nada","Early morning to participate in the sacred Ashtami festival rituals if visiting in November/December","The Vaikom Mahadeva Temple is one of the oldest and most revered Shiva temples in Kerala. It holds immense historical significance, heavily associated with the Vaikom Satyagraha movement, and is famous for its grand Vaikathashtami festival.","The massive temple courtyard, the ancient architecture, and the sacred 'Annadanam' (free food offering) are major highlights for visiting devotees.","Kochi Airport to Chottanikkara Temple taxi","/24x7-kochi-airport-taxi-service/kochi-airport-to-chottanikkara-taxi/","kochi airport to vaikom temple taxi, vaikom mahadeva cab, kochi to vaikom drop, shiva temple taxi kerala"
kochi-airport,Kochi Airport,ettumanoor-mahadeva-temple,Ettumanoor Mahadeva Temple,80,2.5 Hours,"state highways passing through central Kerala towns","Swift Dzire or Innova depending on family size","Muvattupuzha and Kuravilangad","Reliable and respectful transportation directly to the powerful Ettumanoor Mahadeva Temple. We prioritize a smooth ride for families and senior pilgrims.","Temple Main Entrance","Early morning to witness the daily rituals and avoid daytime heat","The Ettumanoor Mahadeva Temple is an ancient and powerful shrine dedicated to Lord Shiva. It is highly famous for its exquisite mural paintings, intricate wood carvings, and the legendary 'Ezharaponnana' (seven and a half golden elephants) display during its annual festival.","Devotees flock to see the magnificent murals, particularly the one depicting Nataraja. The temple's grand architecture and the spiritual ambiance offer a profound pilgrimage experience.","Kochi Airport to Vaikom Temple taxi","/24x7-kochi-airport-taxi-service/kochi-airport-to-vaikom-temple-taxi/","kochi airport to ettumanoor taxi, ettumanoor temple cab, kottayam temple tour taxi, shiva temple drop kochi"
kochi-airport,Kochi Airport,jatayu-earth-center,Jatayu Earth Center,145,3.5 Hours,"national highway (NH66) followed by inland state roads","Toyota Innova Crysta for comfort on the highway and inland turns","Kollam bypass and Kottarakkara","A premium intercity transfer from Kochi to the world's largest bird sculpture. Enjoy a spacious, air-conditioned ride to this incredible mountaintop destination.","Jatayu Earth Center Cable Car Boarding Point","Early morning to reach the center before the intense afternoon sun","Jatayu Earth's Center is a sprawling nature park and tourism center in Chadayamangalam. It holds the Guinness World Record for the largest bird sculpture in the world, depicting the mythical bird Jatayu from the Ramayana, perched dramatically on a massive rocky peak.","Visitors can take a state-of-the-art Swiss cable car to the top, explore the massive sculpture which houses a multi-level museum, and partake in various adventure activities like rock climbing and ziplining.","Kochi Airport to Trivandrum cab service","/24x7-kochi-airport-taxi-service/kochi-airport-to-trivandrum-taxi/","kochi airport to jatayu earth center taxi, jatayu nature park cab, kochi to chadayamangalam drop, world largest bird sculpture taxi"
kochi-airport,Kochi Airport,silent-valley-national-park,Silent Valley National Park,140,3.5 Hours,"national highway followed by winding, dense forest roads in Palakkad","Toyota Innova Crysta for safety and power on forest inclines","Thrissur bypass, Mannarkkad town","Travel safely into Kerala's most pristine tropical evergreen forest. This route requires skilled driving, and our verified chauffeurs are highly trained for forest terrains.","Mukkali Forest Checkpost (Base of Silent Valley)","Very early morning as forest entry is strictly regulated and limited to daylight hours","Silent Valley National Park is a unique, fiercely protected expanse of undisturbed tropical evergreen forest in the Nilgiri Hills. It is renowned for its incredible biodiversity and is one of the last remaining habitats of the endangered Lion-tailed Macaque.","Visitors must take government-approved safari jeeps from Mukkali to explore the forest. Key sights include the crystal-clear Kunthipuzha River, a massive 100-foot watchtower offering panoramic jungle views, and dense, silent woods.","Kochi Airport to Wayanad taxi","/24x7-kochi-airport-taxi-service/kochi-airport-to-wayanad-taxi/","kochi airport to silent valley taxi, palakkad forest cab, silent valley national park drop, mukkali checkpost taxi, eco tourism cab kerala"
kochi-airport,Kochi Airport,nileshwaram,Nileshwaram,310,8.5 Hours,"extremely long coastal highway spanning the Malabar region","Toyota Innova Crysta is mandatory for this long-haul VIP transfer","Kozhikode, Kannur bypass, and Payyanur","The ultimate cross-state premium transfer to the cultural capital of Kasaragod. Travel from central Kerala to the far north in complete air-conditioned luxury.","Nileshwaram Town Center or luxury backwater resorts","Very early morning to cover maximum distance during non-peak highway hours","Nileshwaram, located in the Kasaragod district, is a deeply historical town known for its royal heritage, ancient palaces, and pristine, uncrowded backwaters. It is often referred to as the cultural capital of Kerala's northernmost district.","Visitors love exploring the serene Valiyaparamba backwaters on traditional houseboats, visiting the historic Nileshwaram Palace, and experiencing authentic, high-end Ayurvedic retreats in the area.","Kochi Airport to Bekal Fort taxi","/24x7-kochi-airport-taxi-service/kochi-airport-to-bekal-taxi/","kochi to nileshwaram taxi, kochi airport to nileshwaram cab, kasaragod backwaters taxi, long distance taxi cross state kerala"
kochi-airport,Kochi Airport,gavi-kerala,Gavi (Pathanamthitta),170,5.5 Hours,"highways followed by extremely dense forest roads and steep ghat sections","Toyota Innova Crysta for power, clearance, and safety on rough forest routes","Mundakkayam and Kuttikkanam","Embark on a beautiful, rugged journey into the heart of Kerala's most famous eco-tourism spot. Relax in air-conditioned comfort while our expert drivers navigate the Western Ghats.","Gavi Forest Checkpost or KFDC Eco-Lodge","Very early morning to align with the strict forest entry timings at the checkpost","Gavi is a pristine, highly protected eco-tourism destination nestled deep within the Periyar Tiger Reserve. It gained immense popularity for its untouched wilderness, rolling grasslands, and abundant wildlife sightings including elephants and Nilgiri Tahrs.","Visitors can enjoy guided jungle safaris, boating on the serene Gavi Lake, trekking to Sabarimala viewpoints, and staying in the exclusive forest tents managed by the KFDC.","Kochi Airport to Thekkady taxi","/24x7-kochi-airport-taxi-service/kochi-airport-to-thekkady-taxi/","kochi airport to gavi taxi, gavi forest cab, pathanamthitta eco tourism taxi, innova for gavi trip, kerala forest safari cab"
