from_slug,from_location,to_slug,to_location,distance_km,travel_time,route_terrain,suggested_car,waypoints,unique_desc,popular_drop_point,best_time_to_start,destination_about,top_attractions,internal_link_text,internal_link_url,seo_keywords
kochi-airport,Kochi Airport,munnar,Munnar,110,3.5 Hours,"winding mountain roads, sharp hairpin bends, and steep scenic climbs","Toyota Innova Crysta for premium comfort and stability on hills","Cheeyappara Waterfalls, Valara Waterfalls, and local spice gardens","Experience the ultimate scenic drive from the tropical coast to the misty tea gardens of Munnar. Our expert hill-station drivers ensure a smooth, safe ascent.","Munnar Town Center, Chithirapuram, or your designated resort","Early morning (6 AM - 9 AM) to avoid city traffic and enjoy the misty mountain views","Munnar is Kerala’s most sought-after hill station, perched at an altitude of 1,600 meters in the Western Ghats. Known for its endless expanse of meticulously manicured tea estates, rolling emerald hills, and cool climate, it offers a perfect retreat from the tropical heat.","Don't miss the Eravikulam National Park to spot the endangered Nilgiri Tahr, the Mattupetty Dam for boating, and the Tea Museum to understand the region's rich heritage.","premium Kochi Airport to Alleppey Houseboat taxi service","/24x7-kochi-airport-taxi-service/kochi-airport-to-alleppey-taxi/","kochi to munnar taxi, private cab kochi airport to munnar, best taxi service for munnar trip, innova crysta hire kochi to munnar, munnar sightseeing cab, kochi airport to munnar drop"
kochi-airport,Kochi Airport,alleppey,Alleppey,85,2.5 Hours,"smooth coastal highways (NH66) transitioning into flat urban roads","Maruti Ertiga for families or Swift Dzire for couples","Marari Beach bypass and traditional Kuttanad paddy fields","Transition smoothly from your flight directly to the Venice of the East. We guarantee timely arrivals so you never miss your houseboat departure.","Alleppey Houseboat Finishing Point or local backwater homestays","Morning or early afternoon to align perfectly with standard 12:00 PM houseboat check-ins","Alappuzha, famously known as Alleppey, is the hub of Kerala's backwaters. This enchanting destination is famous for its vast network of tranquil canals, lagoons, and the iconic traditional Kettuvallam houseboats that glide through the waterways.","Must-do activities include an overnight stay in a luxury houseboat, exploring the Marari Beach, and witnessing the rustic village life in the Kuttanad region, known as the rice bowl of Kerala.","comfortable Kochi Airport to Thekkady forest cab transfer","/24x7-kochi-airport-taxi-service/kochi-airport-to-thekkady-taxi/","kochi airport to alleppey taxi, cab for alleppey houseboat, kochi to alappuzha drop, private driver for kerala backwaters, kochi to alleppey taxi fare, ertiga taxi alleppey"
kochi-airport,Kochi Airport,thekkady,Thekkady,150,4.5 Hours,"dense forest roads, elevation changes, and spice plantation routes","Toyota Innova Crysta for spacious legroom on longer journeys","Kuttikkanam misty hills and Pine Forest viewpoints","Embark on a beautiful journey into the heart of Kerala's wildlife sanctuary. Relax in air-conditioned comfort while navigating the lush Western Ghats.","Kumily Town or resorts near Periyar National Park","Early morning to reach before the afternoon wildlife boating sessions","Thekkady is the gateway to the Periyar National Park, one of India's most fascinating wildlife sanctuaries. Immersed in dense evergreen forests and savanna grasslands, it is a haven for nature lovers and wildlife enthusiasts seeking to spot elephants in their natural habitat.","The primary attraction is the Periyar Lake boat safari. Additionally, visitors love the spice plantation tours, elephant bathing experiences, and the traditional Kalaripayattu martial arts shows in Kumily.","scenic Kochi Airport to Munnar hill station taxi","/24x7-kochi-airport-taxi-service/kochi-airport-to-munnar-taxi/","kochi airport to thekkady cab, periyar national park taxi, kochi to kumily drop, innova for thekkady trip, kochi airport to thekkady taxi, kerala wildlife tour cab"
kochi-airport,Kochi Airport,wayanad,Wayanad,250,7.0 Hours,"long highway stretches followed by the famous Thamarassery Churam (hairpin bends)","Toyota Innova Crysta for a long-haul comfortable mountain journey","Kozhikode bypass and Lakkidi Viewpoint","Enjoy a premium, long-distance transfer to the pristine hills of Wayanad. Our experienced drivers easily handle the challenging mountain passes.","Kalpetta, Sulthan Bathery, or Vythiri resorts","Very early morning to cross city limits before peak traffic and enjoy a daylight mountain climb","Wayanad is a lush, forested district in northern Kerala, famous for its spice plantations, wildlife, and indigenous tribal heritage. It sits high on the Western Ghats, offering breathtaking scenery and a cooler climate.","Top sights include the Edakkal Caves with ancient petroglyphs, the serene Pookode Lake, the massive Banasura Sagar Dam, and the Wayanad Wildlife Sanctuary.","Kochi Airport to Kozhikode city transfer","/24x7-kochi-airport-taxi-service/kochi-airport-to-kozhikode-taxi/","kochi to wayanad taxi, kochi airport to wayanad cab, innova kochi to wayanad, wayanad tour packages from kochi, kalpetta taxi drop"
kochi-airport,Kochi Airport,guruvayur,Guruvayur,80,2.5 Hours,"busy national highways (NH66) transitioning into crowded temple town roads","Maruti Ertiga or Innova for family pilgrimage trips","Thrissur bypass and local cultural centers","Experience a punctual, respectful transfer to Kerala's most sacred temple town. We ensure a hassle-free journey for your family's spiritual trip.","East Nada or West Nada near Guruvayur Temple","Late night or very early morning to align with the Nirmalya Darshan timings at the temple","Guruvayur is one of the most sacred pilgrimage centers in South India, home to the historic Guruvayur Sree Krishna Temple. The town revolves around the temple's daily rituals, attracting millions of devotees annually in a spiritually charged atmosphere.","Besides the main temple, devotees visit the Mammiyoor Shiva Temple and the Punnathur Kotta (Anakkotta), an elephant sanctuary housing dozens of temple elephants.","Kochi to Chottanikkara Temple taxi","/24x7-kochi-airport-taxi-service/kochi-airport-to-chottanikkara-taxi/","kochi airport to guruvayur taxi, cab to guruvayur temple, kochi to guruvayur drop, guruvayur devaswom taxi, pilgrimage cab kerala, kochi airport to guruvayur innova"
kochi-airport,Kochi Airport,chottanikkara,Chottanikkara Temple,40,1.5 Hours,"city traffic roads and suburban highways","Swift Dzire for easy maneuvering through suburban Kochi","Kochi city bypass and Tripunithura heritage town","A fast, comfortable ride straight from the airport to the divine Chottanikkara Bhagavathy Temple. Perfect for quick pilgrimage visits.","Main Temple Entrance or nearby Devaswom accommodations","Early morning to attend the Makam Thozhal or morning poojas","Chottanikkara is home to the highly revered Chottanikkara Bhagavathy Temple, a prominent shrine dedicated to the Mother Goddess. It is famous for its powerful spiritual energy and the belief that the Goddess cures mental and physical ailments.","The main attraction is the temple complex itself, including the Keezhkkaavu temple and the daily rituals that draw thousands of seeking devotees.","Kochi Airport to Guruvayur Temple cab","/24x7-kochi-airport-taxi-service/kochi-airport-to-guruvayur-taxi/","kochi airport to chottanikkara taxi, chottanikkara temple cab, kochi to chottanikkara drop, temple tour taxi kochi"
kochi-airport,Kochi Airport,sabarimala-pamba,Pamba (Sabarimala),155,4.5 Hours,"highways followed by dense forest roads and steep ghat sections","Toyota Innova for safety, space, and comfort on the Sabarimala route","Erumeli Sastha Temple and Plappally forest checkpost","Safe and reliable drops to the Pamba base camp for Sabarimala pilgrims. Our drivers are highly experienced with the busy pilgrimage season traffic.","Pamba Base Camp or Nilakkal Parking Hub","Late night to reach Pamba by early morning to begin the hill trek","Pamba is the vital base camp on the banks of the sacred Pamba River, serving as the starting point for the trek to the Sabarimala Ayyappa Temple. It is surrounded by the dense forests of the Periyar Tiger Reserve.","The primary activity is taking a holy dip in the Pamba River before beginning the arduous trek to the Sabarimala Sree Dharma Sastha Temple.","Kochi Airport to Trivandrum cab service","/24x7-kochi-airport-taxi-service/kochi-airport-to-trivandrum-taxi/","kochi airport to pamba taxi, sabarimala base camp cab, kochi to nilakkal drop, innova for sabarimala trip, sabarimala season taxi, kochi to pamba fare"
kochi-airport,Kochi Airport,padmanabhaswamy-temple,Padmanabhaswamy Temple (Trivandrum),230,5.5 Hours,"long national highway (NH66) with heavy coastal traffic","Toyota Innova Crysta for maximum comfort on a long journey","Kollam bypass and Trivandrum city center","A premium intercity transfer from Kochi to the richest temple in the world. Enjoy a spacious, air-conditioned ride down the Kerala coast.","East Fort Entrance near Padmanabhaswamy Temple","Very early morning to avoid daytime highway traffic along NH66","Located in the heart of Thiruvananthapuram, the Sree Padmanabhaswamy Temple is an architectural marvel blending Kerala and Dravidian styles. It gained global fame as the wealthiest place of worship in the world, dedicated to Lord Vishnu.","The temple's intricate stone carvings and the towering Gopuram are must-sees. Nearby attractions include the Napier Museum and the Kuthira Malika Palace.","Kochi Airport to Varkala Beach taxi","/24x7-kochi-airport-taxi-service/kochi-airport-to-varkala-taxi/","kochi to trivandrum taxi, padmanabhaswamy temple cab, kochi airport to thiruvananthapuram drop, intercity taxi kochi to trivandrum"
kochi-airport,Kochi Airport,aster-medcity,Aster Medcity Kochi,25,0.45 Hours,"smooth city highways and the container terminal road","Swift Dzire or Innova depending on patient comfort requirements","Edappally bypass and scenic Cheranalloor backwater bridge","Prompt, comfortable, and stress-free airport transfers specifically for medical tourists arriving for treatment at Aster Medcity.","Aster Medcity Main Reception or Emergency Entrance","Anytime (24x7 service for all incoming medical flights)","Aster Medcity is one of India's most advanced healthcare destinations, situated beautifully on the banks of the Periyar River. It draws thousands of international and domestic patients for complex medical treatments and robotic surgeries.","While primarily a medical hub, its peaceful riverside campus provides a healing environment. It is conveniently close to the Lulu Mall and Edappally center for accompanying family members.","Kochi Airport to Amrita Hospital taxi","/24x7-kochi-airport-taxi-service/kochi-airport-to-amrita-hospital-taxi/","kochi airport to aster medcity taxi, cab for aster medcity kochi, medical tourism taxi kerala, kochi airport hospital transfer, aster hospital drop taxi"
kochi-airport,Kochi Airport,amrita-hospital,Amrita Hospital (AIMS),25,0.45 Hours,"city highways and Edappally toll road","Swift Dzire or Ertiga for family members accompanying patients","Aluva bypass and Edappally Junction","Reliable and fast transportation from the terminal directly to Amrita Hospital. We prioritize smooth driving for the comfort of our medical guests.","Amrita Hospital Main Block or Patient Accommodations","Anytime (24x7 service available for emergencies or scheduled admissions)","Amrita Institute of Medical Sciences (AIMS) is a premier super-specialty hospital in Kochi, renowned for its charitable foundations, advanced transplants, and massive healthcare infrastructure serving thousands daily.","Located in Edappally, the hospital is heavily focused on healthcare, but family members often visit the nearby Oberon Mall or Lulu Mall for necessities and relaxation.","Kochi Airport to Rajagiri Hospital taxi","/24x7-kochi-airport-taxi-service/kochi-airport-to-rajagiri-hospital-taxi/","kochi airport to amrita hospital taxi, aims hospital cab kochi, kochi medical transfer, edappally hospital taxi"
kochi-airport,Kochi Airport,rajagiri-hospital,Rajagiri Hospital Aluva,15,0.30 Hours,"smooth, short suburban roads","Swift Dzire for a quick and cost-effective local transfer","Aluva town center","The absolute fastest and most direct transfer from the airport to Rajagiri Hospital. A smooth, 30-minute ride for medical consultations and admissions.","Rajagiri Hospital Main Entrance Chunangamvely","Anytime (24x7 rapid local taxi service)","Rajagiri Hospital is a state-of-the-art multi-specialty healthcare facility located near Aluva, set in a massive, green, and serene 40-acre campus designed to promote rapid healing and patient well-being.","Situated in the quiet suburbs of Chunangamvely, the area offers a peaceful environment for patients, with easy access to Aluva's riverbanks and town amenities.","Kochi Airport to Aster Medcity cab","/24x7-kochi-airport-taxi-service/kochi-airport-to-aster-medcity-taxi/","kochi airport to rajagiri hospital cab, aluva hospital taxi, fast cab to rajagiri hospital, kochi airport medical drop"
kochi-airport,Kochi Airport,taj-kumarakom,Taj Kumarakom Resort & Spa,80,2.5 Hours,"highway driving followed by narrow, scenic lakeside village roads","Toyota Innova Crysta for luxury resort transfers","Vembanad Lake viewpoints and bird sanctuary outskirts","Start your luxury vacation the moment you land. Our premium chauffeurs will whisk you away to the world-renowned Taj Kumarakom in absolute comfort.","Taj Kumarakom Resort Main Lobby","Morning or afternoon to enjoy the scenic lakeside drive upon arrival","The Taj Kumarakom Resort & Spa is a 5-star luxury heritage property set on the eastern banks of Vembanad Lake. Originally a colonial bungalow built in 1881, it offers an incredibly opulent backwater experience.","Guests enjoy private sunset cruises on the lake, Ayurvedic spa treatments, and immediate access to the neighboring Kumarakom Bird Sanctuary.","Kochi Airport to Zuri Kumarakom taxi","/24x7-kochi-airport-taxi-service/kochi-airport-to-zuri-kumarakom-taxi/","kochi airport to taj kumarakom taxi, luxury cab for kumarakom resorts, innova to taj kumarakom, kochi airport resort transfer"
kochi-airport,Kochi Airport,grand-hyatt-kochi,Grand Hyatt Kochi Bolgatty,35,1.0 Hours,"city toll roads and scenic island bridges","Toyota Innova Crysta or Swift Dzire depending on luggage","Marine Drive and Bolgatty Island bridge","Skip the city traffic and cross the scenic bridge directly to the Grand Hyatt. The perfect premium transfer for business travelers and luxury vacationers.","Grand Hyatt Kochi Bolgatty Main Entrance","Anytime (24x7 service for all corporate and VIP arrivals)","The Grand Hyatt Kochi Bolgatty is a spectacular waterfront urban resort overlooking the Vembanad Lake. It is Kochi's premier destination for luxury stays, international conferences, and opulent destination weddings.","Located on Bolgatty Island, guests can easily visit the historic Bolgatty Palace, explore the Lulu International Convention Center, or take a short ferry to Fort Kochi.","Kochi Airport to Fort Kochi heritage taxi","/24x7-kochi-airport-taxi-service/kochi-airport-to-fort-kochi-taxi/","kochi airport to grand hyatt taxi, bolgatty island cab, luxury hotel transfer kochi, innova for grand hyatt kochi"
kochi-airport,Kochi Airport,leela-kovalam,The Leela Kovalam,230,5.5 Hours,"long coastal highway (NH66) requiring a comfortable vehicle","Toyota Innova Crysta for premium long-haul comfort","Kollam Backwaters and Trivandrum City bypass","A long, luxurious coastal drive from Kochi straight to India's finest cliffside beach resort. Sit back, relax, and enjoy the premium VIP service.","The Leela Kovalam (Raviz) Reception","Very early morning or late night to bypass heavy daytime traffic","The Leela Kovalam (now The Raviz Kovalam) is India’s only cliff-top beach resort, offering breathtaking panoramic views of the Arabian Sea. It is the epitome of luxury, famous for its private beaches and world-class infinity pools.","Guests can step directly onto the pristine Kovalam Beach, visit the iconic Vizhinjam Lighthouse, and experience authentic, high-end Ayurvedic therapies.","Kochi Airport to Varkala Cliff taxi","/24x7-kochi-airport-taxi-service/kochi-airport-to-varkala-taxi/","kochi airport to leela kovalam taxi, kovalam resort cab, luxury taxi to trivandrum resorts, innova kochi to kovalam"
kochi-airport,Kochi Airport,zuri-kumarakom,The Zuri Kumarakom Resort,80,2.5 Hours,"highway driving followed by narrow lakeside roads","Toyota Innova Crysta for a spacious and luxurious ride","Vembanad Lake shores and local paddy fields","A seamless, luxurious journey from the tarmac to your private villa. Let our professional chauffeurs navigate the backwater roads while you relax.","The Zuri Kumarakom Main Lobby","Morning or afternoon to align with standard hotel check-in times","The Zuri Kumarakom is a lavish 5-star resort sprawling across 18 acres on the shores of Vembanad Lake. It is celebrated for its Maya Spa, which is one of the largest and most awarded Ayurvedic spas in South India.","Aside from the world-class spa, visitors can enjoy private lagoon boating, sunset cruises on the lake, and exploring the serene Kumarakom Bird Sanctuary.","Kochi Airport to Taj Kumarakom taxi","/24x7-kochi-airport-taxi-service/kochi-airport-to-taj-kumarakom-taxi/","kochi airport to zuri kumarakom taxi, zuri resort cab kochi, luxury transfer to kumarakom, premium taxi for backwater resorts"
kochi-airport,Kochi Airport,fort-kochi,Fort Kochi,45,1.5 Hours,"busy urban city traffic, toll roads, and historic bridges","Swift Dzire or Etios for easy navigation through narrow heritage streets","Marine Drive, Willingdon Island, and the harbor bridges","Skip the confusing city traffic and head straight to the heritage zone. A perfect, quick transfer to kick off your cultural Kerala itinerary.","Princess Street, Parade Ground, or boutique heritage hotels","Anytime (24x7 service), though late evening offers the fastest travel time","Fort Kochi is a charming seaside heritage town known for its unique blend of Dutch, Portuguese, and British colonial architecture. It is the cultural heart of Kochi, famous for its vibrant art scene and laid-back cafes.","The iconic Chinese Fishing Nets are a must-see, along with the historic St. Francis Church, the Santa Cruz Basilica, and the bustling antique shops of Jew Town in Mattancherry.","Kochi Airport to Cherai Beach taxi","/24x7-kochi-airport-taxi-service/kochi-airport-to-cherai-beach-taxi/","kochi airport to fort kochi taxi, cab to fort kochi beach, heritage tour taxi kochi, kochi airport to mattancherry drop"
kochi-airport,Kochi Airport,cherai-beach,Cherai Beach,25,0.45 Hours,"smooth coastal village roads and backwater bridges","Swift Dzire or Ertiga for family beach trips","North Paravur bypass and serene backwater crossings","Touch down and head straight to the beach! A short, beautiful drive across the backwaters to one of Kochi's most pristine and family-friendly beaches.","Cherai Beach resorts or main beach walkway","Anytime, perfect for watching the sunset upon arrival","Cherai Beach is a unique, picturesque destination where the tranquil Kerala backwaters meet the roaring Arabian Sea. Located on Vypin Island, it boasts a long, clean coastline perfect for swimming and sunbathing.","Visitors love watching the dolphins, exploring the Munambam Breakwater, and enjoying fresh local seafood at the numerous beachside shacks and resorts.","Kochi Airport to Fort Kochi cab","/24x7-kochi-airport-taxi-service/kochi-airport-to-fort-kochi-taxi/","kochi airport to cherai beach taxi, cherai resort cab, vypin island taxi service, beach drop kochi airport"
kochi-airport,Kochi Airport,athirappilly,Athirappilly Waterfalls,40,1.5 Hours,"smooth state highways followed by winding, dense forest roads","Swift Dzire or Ertiga for a quick and comfortable forest drive","Thumboormuzhi Dam, Butterfly Park, and oil palm plantations","Take a short, breathtaking trip to the 'Niagara of India.' Our local drivers know the forest routes safely, allowing you to enjoy the lush canopy.","Athirappilly Waterfalls entrance or nearby rainforest resorts","Early morning to beat the tourist crowds at the waterfalls","Athirappilly is home to Kerala’s most magnificent waterfall, plunging 80 feet through the dense Sholayar rainforest. The surrounding jungle is a biodiversity hotspot, famously featured in numerous blockbuster Indian films like 'Baahubali'.","The majestic waterfalls are the main draw, alongside the nearby Vazhachal Waterfalls and the tranquil Thumboormuzhi Butterfly Garden on the Chalakudy River.","Kochi Airport to Munnar hill station taxi","/24x7-kochi-airport-taxi-service/kochi-airport-to-munnar-taxi/","kochi airport to athirappilly taxi, cab to athirappilly waterfalls, chalakudy forest taxi, kerala waterfalls cab service"
kochi-airport,Kochi Airport,varkala,Varkala Beach,200,5.0 Hours,"long stretches of national highway (NH66) with heavy coastal traffic","Toyota Innova Crysta for maximum comfort on a 5-hour journey","Kollam Backwaters and Krishnapuram Palace","Sit back for a premium, long-haul coastal transfer down to Kerala's most famous cliffside beach. A spacious vehicle makes this long drive effortless.","Varkala North Cliff, South Cliff, or Helipad area","Very early morning or late night to bypass heavy daytime highway traffic","Varkala is a unique coastal town in southern Kerala where stunning red laterite cliffs plunge directly into the Arabian Sea. It is a hippie haven known for its laid-back vibe, surf schools, and yoga retreats.","The Varkala Cliff and Papanasam Beach are the focal points. Visitors also flock to the ancient 2,000-year-old Janardanaswamy Temple and the serene Sivagiri Mutt.","Kochi Airport to Trivandrum cab","/24x7-kochi-airport-taxi-service/kochi-airport-to-trivandrum-taxi/","kochi airport to varkala taxi, cab to varkala cliff, varkala beach resort drop, long distance taxi kochi to varkala"
kochi-airport,Kochi Airport,vagamon,Vagamon,100,3.5 Hours,"steep inclines, sharp curves, and high-altitude misty terrain","Toyota Innova Crysta for power and safety on steep mountain roads","Pine Valley outskirts and Illikkal Kallu viewpoints","Travel safely into Kerala's untouched, misty meadows. This route requires skilled driving, and our verified chauffeurs are trained for these exact hills.","Vagamon Meadows area or remote eco-resorts","Daylight hours only (before 4 PM) as heavy mist reduces visibility at night","Vagamon is an offbeat, tranquil hill station known for its rolling green pine forests, sprawling meadows, and mist-covered valleys. It remains much less commercialized than Munnar, offering a pristine escape into nature.","Adventure seekers love paragliding over the Vagamon Meadows. The Pine Valley, Kurisumala Ashram, and the sheer drop at suicide point (Mooppan Para) are highly popular.","Kochi Airport to Thekkady taxi","/24x7-kochi-airport-taxi-service/kochi-airport-to-thekkady-taxi/","kochi airport to vagamon taxi, cab to vagamon hills, innova for vagamon trip, offbeat kerala hill station taxi"
kochi-airport,Kochi Airport,marari,Marari Beach,75,2.0 Hours,"straight coastal highways (NH66) and narrow beach access roads","Swift Dzire or Ertiga for couples and small families","Arthunkal Church and serene coastal fishing villages","Head straight from the tarmac to the tranquil white sands of Marari. A fast, straightforward transfer perfect for recovering from jet lag.","Mararikulam beach resorts and private villas","Anytime (24x7 service available for all flight arrivals)","Marari (Mararikulam) is a peaceful, secluded fisherman's village that has transformed into an eco-friendly beach destination. It offers a pristine, untouched alternative to the busier commercial beaches of Kerala.","Relaxing by the Arabian sea is the main agenda, though many guests enjoy cycling through the local village, visiting traditional coir-making units, and experiencing Ayurvedic therapies.","Kochi Airport to Alleppey taxi","/24x7-kochi-airport-taxi-service/kochi-airport-to-alleppey-taxi/","kochi airport to marari beach taxi, mararikulam resort cab, beach drop kochi airport, peaceful kerala beach taxi"
kochi-airport,Kochi Airport,trivandrum,Thiruvananthapuram (Trivandrum),220,5.5 Hours,"long coastal highway (NH66) requiring a comfortable vehicle","Toyota Innova Crysta for premium long-haul comfort","Kollam city bypass and Attingal","A reliable, intercity premium cab service connecting Kerala's commercial hub to its capital city. Perfect for corporate travel, political visits, or southern tours.","Trivandrum City Center, Secretariat, or local hotels","Very early morning or late night to bypass heavy daytime traffic","Thiruvananthapuram, or Trivandrum, is the capital city of Kerala. It is a major academic, political, and IT hub, beautifully balancing its rich royal heritage with rapid modern development.","The city is famous for the Padmanabhaswamy Temple, the Napier Museum, the adjacent Zoo, and the magnificent Kuthira Malika Palace built by the Travancore kings.","Kochi Airport to Varkala taxi","/24x7-kochi-airport-taxi-service/kochi-airport-to-varkala-taxi/","kochi to trivandrum taxi, kochi airport to thiruvananthapuram cab, intercity taxi kerala, innova to trivandrum"
