from_slug,from_location,to_slug,to_location,distance_km,travel_time,route_terrain,suggested_car,waypoints,unique_desc,popular_drop_point,best_time_to_start,destination_about,top_attractions,internal_link_text,internal_link_url,seo_keywords
kochi-airport,Kochi Airport,thiruvalla,Thiruvalla,110,3.0 Hours,"state highways passing through multiple central Kerala towns","Swift Dzire or Ertiga for standard family and NRI travel","Muvattupuzha, Koothattukulam, and Changanassery","A comfortable and direct cab service from the terminal to the heart of Pathanamthitta district. Ideal for NRI arrivals and family visits to central Kerala.","Thiruvalla Town Center or specific residential drops","Anytime, though early morning or late night helps avoid heavy daytime town traffic","Thiruvalla is a bustling, affluent town in the Pathanamthitta district, widely known as the 'NRI capital' of Kerala due to its large expatriate population. It perfectly blends urban development with serene, traditional Kerala backwater landscapes on its western borders.","The town is famous for the ancient Sree Vallabha Temple, one of the 108 Divya Desams, and the massive Paliakkara Church. Visitors also enjoy the tranquil, agricultural beauty of the Kuttanad region bordering the town.","Kochi Airport to Kottayam taxi","/24x7-kochi-airport-taxi-service/kochi-airport-to-kottayam-taxi/","kochi to thiruvalla taxi, kochi airport to thiruvalla cab, pathanamthitta district taxi, nri drop cab thiruvalla"
kochi-airport,Kochi Airport,changanassery,Changanassery,100,2.5 Hours,"state highways passing through rubber plantations and central towns","Swift Dzire or Ertiga for family and business travel","Muvattupuzha, Koothattukulam, and Kottayam bypass","Enjoy a scenic drive through the heartland of Kerala. A highly reliable drop service for both business travelers and families visiting the Kottayam district.","Changanassery Town Center or local residential drops","Anytime, though daytime offers scenic views of the central Kerala landscape","Changanassery is a major commercial and cultural hub in the Kottayam district, serving as a gateway between the high ranges and the Kuttanad backwaters. It is deeply known for its historical trade significance and religious harmony.","The town boasts prominent landmarks such as the vibrant Changanassery Market, the historic Parel St. Mary's Syro-Malabar Catholic Church, and the ancient Thrikkodithanam Mahadeva Temple nearby.","Kochi Airport to Alleppey taxi","/24x7-kochi-airport-taxi-service/kochi-airport-to-alleppey-taxi/","kochi to changanassery taxi, kochi airport to changanassery cab, kottayam district taxi service, central kerala cab kochi"
kochi-airport,Kochi Airport,blanket-hotel-munnar,Blanket Hotel & Spa Munnar,105,3.5 Hours,"winding mountain roads, sharp hairpin bends, and steep scenic climbs","Toyota Innova Crysta for premium comfort and stability on hills","Cheeyappara Waterfalls and Valara Waterfalls","Experience the ultimate scenic drive from the tropical coast directly to one of Munnar's finest luxury eco-hotels. Our expert hill-station drivers ensure a smooth, safe ascent.","Blanket Hotel & Spa Main Lobby (Pallivasal)","Early morning (6 AM - 9 AM) to avoid city traffic and enjoy the misty mountain views","Blanket Hotel & Spa is a premium 5-star luxury property situated near the spectacular Attukad Waterfalls in Pallivasal, Munnar. It is renowned for its eco-friendly practices, luxurious amenities, and breathtaking views of the surrounding tea plantations.","Guests can enjoy world-class spa treatments, infinity pools overlooking the valley, guided tea plantation walks, and easy access to the majestic Attukad Waterfalls right next to the property.","Kochi Airport to Munnar hill station taxi","/24x7-kochi-airport-taxi-service/kochi-airport-to-munnar-taxi/","kochi airport to blanket hotel taxi, luxury cab for munnar resorts, innova to blanket hotel, kochi airport munnar resort transfer, pallivasal taxi drop"
kochi-airport,Kochi Airport,medical-trust-kochi,Medical Trust Hospital Kochi,35,1.0 Hours,"city highways and busy urban roads","Swift Dzire or Innova depending on patient comfort requirements","Edappally bypass and MG Road","Prompt, comfortable, and stress-free airport transfers specifically for medical tourists arriving for treatment in the heart of Kochi city.","Medical Trust Hospital Main Entrance Pallimukku","Anytime (24x7 service for all incoming medical flights)","Medical Trust Hospital is one of the oldest and most trusted multi-specialty healthcare institutions in Kochi. Located in the bustling Pallimukku area, it is a pioneer in complex surgeries, cardiology, and comprehensive trauma care.","Being centrally located on MG Road, bystanders have immediate access to Kochi's major commercial hubs, hotels, and shopping centers like the Centre Square Mall.","Kochi Airport to Aster Medcity taxi","/24x7-kochi-airport-taxi-service/kochi-airport-to-aster-medcity-taxi/","kochi airport to medical trust hospital taxi, cab for medical trust kochi, mg road hospital taxi, kochi airport patient drop, fast medical cab kochi"
kochi-airport,Kochi Airport,kadampuzha-devi-temple,Kadampuzha Devi Temple,130,3.5 Hours,"coastal highway (NH66) moving northwards through bustling towns","Toyota Innova Crysta or Ertiga for a smooth highway pilgrimage journey","Thrissur bypass, Kunnamkulam, and Valanchery","Travel north with our expert intercity drivers. We ensure a safe, comfortable, and respectful journey to this highly revered Goddess temple in Malappuram.","Kadampuzha Devi Temple Main Entrance","Early morning to navigate through the busy NH66 intersections and attend morning poojas","The Kadampuzha Devi Temple, located in the Malappuram district, is a highly unique and powerful shrine dedicated to Goddess Parvati. Notably, the temple has no idol; the Goddess is worshipped in a pit, and it is famous for the unique 'Poomoodal' offering where the deity is completely covered with flowers.","Devotees visit primarily to perform the 'Muttarukkal' ritual to remove obstacles in life. The serene atmosphere of the temple provides a deeply spiritual experience.","Kochi Airport to Guruvayur Temple taxi","/24x7-kochi-airport-taxi-service/kochi-airport-to-guruvayur-taxi/","kochi airport to kadampuzha taxi, kadampuzha temple cab, kochi to malappuram temple drop, poomoodal temple taxi kerala, pilgrimage cab kochi"
kochi-airport,Kochi Airport,edakkal-caves-wayanad,Edakkal Caves Wayanad,260,7.5 Hours,"long highway stretches followed by the famous Thamarassery Churam and steep local roads","Toyota Innova Crysta for a long-haul comfortable mountain journey","Kozhikode bypass, Lakkidi Viewpoint, and Ambalavayal","Enjoy a premium, long-distance transfer to the historic peaks of Wayanad. Our experienced drivers easily handle the challenging mountain passes and the steep approach to the caves.","Edakkal Caves Base Parking Area","Very early morning to cross city limits before peak traffic and start the cave trek by midday","The Edakkal Caves are two natural alcoves set high in the Ambukuthi Hills of Wayanad. They are globally significant for housing ancient petroglyphs (rock carvings) dating back to the Neolithic age, offering a rare glimpse into prehistoric civilization.","Reaching the caves involves a steep, scenic trek up the hill, which is a major part of the experience. The surrounding area offers breathtaking panoramic views of the Wayanad landscape.","Kochi Airport to Wayanad taxi","/24x7-kochi-airport-taxi-service/kochi-airport-to-wayanad-taxi/","kochi to edakkal caves taxi, kochi airport to wayanad historical sites, innova kochi to edakkal, wayanad sightseeing cab, ambukuthi hills drop"
kochi-airport,Kochi Airport,vypin-island,Vypin Island,35,1.0 Hours,"smooth coastal village roads and massive backwater bridges","Swift Dzire or Ertiga for family beach trips","Kalamassery, Edappally, and Goshree Bridges","Touch down and head straight to the coast! A beautiful, breezy drive across the spectacular Goshree bridges directly to the vibrant Vypin Island.","Vypin Main Junction or local beach resorts","Anytime, perfect for enjoying the coastal breeze upon arrival","Vypin is a densely populated and incredibly scenic barrier island forming part of the city of Kochi. It stretches for 27 kilometers and is bordered by the Arabian Sea on the west and the Vembanad Lake on the east, famous for its beaches and lighthouses.","The island is home to the stunning Cherai Beach, Kuzhupilly Beach, the historic Ochanthuruth Lighthouse, and the massive Pallipuram Fort built by the Portuguese.","Kochi Airport to Cherai Beach taxi","/24x7-kochi-airport-taxi-service/kochi-airport-to-cherai-beach-taxi/","kochi airport to vypin taxi, vypin island cab, goshree bridge taxi, beach drop kochi airport, coastal tour cab kochi"
kochi-airport,Kochi Airport,malampuzha-dam,Malampuzha Dam,120,2.5 Hours,"smooth multi-lane national highway (NH544)","Swift Dzire or Ertiga for a fast highway cruise","Thrissur bypass, Kuthiran Tunnel, and Palakkad town","A rapid, smooth highway transfer to the largest reservoir in Kerala. We utilize the new tunnel routes to drastically cut down travel time and ensure your comfort.","Malampuzha Gardens Main Entrance","Early morning or late afternoon to enjoy the gardens without the harsh midday sun","Malampuzha Dam, located near Palakkad at the foothills of the Western Ghats, is the largest reservoir in Kerala. The area around the dam has been developed into a massive entertainment complex, drawing thousands of families and tourists.","The meticulously manicured Malampuzha Gardens are a massive attraction, along with the iconic Yakshi statue, a scenic ropeway ride across the gardens, a rock garden, and an adjacent amusement park.","Kochi Airport to Palakkad taxi","/24x7-kochi-airport-taxi-service/kochi-airport-to-palakkad-taxi/","kochi to malampuzha taxi, kochi airport to malampuzha dam cab, highway taxi to palakkad attractions, family tour cab kerala"
kochi-airport,Kochi Airport,malayattoor-church,Malayattoor Church,15,0.30 Hours,"smooth, short suburban and riverside roads","Swift Dzire for a quick and cost-effective local transfer","Kalady and Periyar riverbanks","The absolute fastest and most direct transfer from the airport to the sacred hills of Malayattoor. A smooth, 30-minute scenic ride along the river.","Malayattoor Base Camp (Kurisumudi Base)","Early morning to begin the pilgrimage trek up the hill in cool weather","Malayattoor is a highly revered Christian pilgrimage center located on the banks of the Periyar River. It is famous for the Kurisumudi mountain, where St. Thomas the Apostle is believed to have prayed and left his footprints.","The primary activity is the spiritual trek up the Kurisumudi hill, especially during the Lenten season. The beautiful St. Thomas International Shrine at the peak offers stunning views of the river and forests below.","Kochi Airport to Kalady taxi","/24x7-kochi-airport-taxi-service/kochi-airport-to-kalady-taxi/","kochi airport to malayattoor taxi, malayattoor church cab, fast cab to malayattoor, kochi airport pilgrimage drop, kurisumudi taxi"
kochi-airport,Kochi Airport,niraamaya-retreats-kovalam,Niraamaya Retreats Surya Samudra Kovalam,230,5.5 Hours,"long coastal highway (NH66) requiring a comfortable VIP vehicle","Toyota Innova Crysta for premium long-haul comfort","Kollam Backwaters and Trivandrum City bypass","A long, luxurious coastal drive from Kochi straight to one of India's most exclusive cliffside wellness retreats. Sit back, relax, and enjoy the premium VIP service.","Niraamaya Retreats Surya Samudra Reception","Very early morning or late night to bypass heavy daytime traffic","Niraamaya Retreats Surya Samudra is an incredibly luxurious, award-winning wellness resort located on a dramatic cliff edge in Kovalam. It is famous for its traditional Kerala heritage cottages (Tharavads) and its globally recognized Ayurvedic spa.","Guests experience ultimate privacy with secluded beaches, world-class Ayurvedic wellness programs, infinity pools blending into the Arabian Sea, and exceptional fine dining.","Kochi Airport to Leela Kovalam taxi","/24x7-kochi-airport-taxi-service/kochi-airport-to-leela-kovalam-taxi/","kochi airport to niraamaya kovalam taxi, surya samudra resort cab, luxury taxi to trivandrum wellness retreats, innova kochi to kovalam resorts"
kochi-airport,Kochi Airport,kodungallur,Kodungallur,35,1.0 Hours,"smooth coastal highway and suburban roads","Swift Dzire or Ertiga for quick family and heritage travel","North Paravur and Kottappuram","A highly efficient airport transfer to the ancient port city of Kerala. Smooth driving ensures you reach the historic sites of Kodungallur in just an hour.","Kodungallur Bhagavathy Temple or Town Center","Anytime, perfectly suited for historical day tours","Kodungallur, historically known as Muziris, is an ancient port city in the Thrissur district that served as the gateway for multiple world religions into India. It is steeped in profound historical and cultural significance.","The town is home to the powerful Kodungallur Bhagavathy Temple, the Cheraman Juma Masjid (the first mosque in India), and the Marthoma Pontifical Shrine, making it a unique hub of religious history.","Kochi Airport to Thrissur taxi","/24x7-kochi-airport-taxi-service/kochi-airport-to-thrissur-taxi/","kochi to kodungallur taxi, kochi airport to kodungallur cab, muziris heritage taxi, ancient port city cab kochi"